{
  "full_name": "Jane Example",
  "party_or_independent": "Independent",
  "seat": "MCA",
  "constituency": "Kilifi North",
  "ward": "Dabaso",
  "bio": "Sample profile for testing.",
  "pledges": ["Pledge 1", "Pledge 2", "Pledge 3", "Pledge 4", "Pledge 5"],
  "contact": {"phone": "", "email": "", "social": []},
  "verified": false
}
